{
  "schemaVersion": 1,
  "networkName": "company-overlay",
  "secretFile": "network.secret",
  "role": "Client",
  "seedPhysicalIp": "192.0.2.10",
  "port": 11010,
  "corePath": "easytier-core",
  "cliPath": "easytier-cli",
  "rpcPort": 15888,
  "deviceName": "easytierhost",
  "enableInternetGateway": false
}
